{
  "schema_version": "v1",
  "id": "exec-meal-planner-001",
  "task_id": "task-meal-planner-001",
  "plan_id": "plan-meal-planner-001",
  "step_id": "step-update-empty-state",
  "action": "Revise the shopping-list empty state and add a call to action that routes users to meal-plan generation in the existing meal-planner frontend.",
  "input_context": {
    "repo_profile_id": "repo-profile-meal-planner",
    "target_files": [
      "frontend/src/routes/shopping-list/index.tsx",
      "frontend/src/routes/meal-plans/index.tsx"
    ],
    "working_root": "frontend",
    "protected_paths_checked": [
      ".github",
      ".claude",
      ".copilot",
      ".squad",
      "meal_planner.db",
      "target"
    ]
  },
  "tool_calls": [
    {
      "tool": "view",
      "status": "completed",
      "trace_id": "trace-meal-planner-001"
    },
    {
      "tool": "apply_patch",
      "status": "completed",
      "trace_id": "trace-meal-planner-001"
    },
    {
      "tool": "bash",
      "status": "completed",
      "trace_id": "trace-meal-planner-001"
    }
  ],
  "output_artifact_ids": [
    "artifact-meal-planner-001"
  ],
  "status": "done"
}
